{
  "name": "Abdul Basit",
  "country": "Pakistan",
  "role": "Full-Stack Developer",
  "github": "https://github.com/AbdulBasitx19",
  "linkedin": "https://www.linkedin.com/in/abdul-basit-chaudhry-9129391b9/",
  "portfolio": "https://abdulbasitx19.vercel.app/",
  "highlight": "Full-Stack Developer currently working in Pakistan, building secure full-stack web applications."
}

