{
  "name": "Example Contributor",
  "country": "Pakistan",
  "role": "Frontend Developer",
  "github": "https://github.com/example-user",
  "linkedin": "https://www.linkedin.com/in/example-user",
  "portfolio": "https://example.com",
  "highlight": "Learning open-source contribution through clean Pull Requests."
}