{
  "name": "Suresh Kumar Barach",
  "country": "Pakistan",
  "role": "Full-Stack Developer",
  "github": "https://github.com/sureshbarach2001",
  "linkedin": "https://www.linkedin.com/in/sureshkumarbarach/",
  "portfolio": "https://sureshkumar2001.vercel.app/",
  "highlight": "Full-Stack Developer currently working in Egypt, building secure full-stack web applications."
}